{
  "skill_name": "V4 PR Review / Merge Gate Skill",
  "pr_number": 103,
  "pr_title": "Synthetic missing CI evidence PR",
  "branch": "synthetic-missing-ci",
  "base_branch": "main",
  "head_sha": "synthetic103",
  "mergeable": true,
  "draft": false,
  "claimed_scope": "Governed fixture with missing GitHub Actions evidence.",
  "changed_files": [
    { "path": "docs/skills/example.md", "change_type": "added", "additions": 10, "deletions": 0, "review_category": "skill_docs", "scope_status": "in_scope", "notes": "Synthetic skill doc." }
  ],
  "ci_run_id": "unknown",
  "ci_status": "missing",
  "ci_conclusion": "missing",
  "ci_required_steps": [
    { "name": "pnpm install --frozen-lockfile=false", "required": true, "status": "missing", "conclusion": "missing", "evidence": "No GitHub Actions evidence supplied" },
    { "name": "pnpm build", "required": true, "status": "missing", "conclusion": "missing", "evidence": "No GitHub Actions evidence supplied" },
    { "name": "pnpm typecheck", "required": true, "status": "missing", "conclusion": "missing", "evidence": "No GitHub Actions evidence supplied" },
    { "name": "pnpm test", "required": true, "status": "missing", "conclusion": "missing", "evidence": "No GitHub Actions evidence supplied" },
    { "name": "pnpm validate:rules", "required": true, "status": "missing", "conclusion": "missing", "evidence": "No GitHub Actions evidence supplied" },
    { "name": "pnpm sample:vs1a", "required": true, "status": "missing", "conclusion": "missing", "evidence": "No GitHub Actions evidence supplied" },
    { "name": "pnpm sample:vs1a:upload", "required": true, "status": "missing", "conclusion": "missing", "evidence": "No GitHub Actions evidence supplied" }
  ],
  "ci_all_required_steps_passed": false,
  "scope_alignment": "aligned",
  "guardrail_compliance": "compliant",
  "drift_risk": "low",
  "real_job_data_detected": false,
  "pdf_intelligence_detected": false,
  "unauthorized_quantity_or_cost_output_detected": false,
  "unauthorized_current_state_update_detected": false,
  "unauthorized_airtable_governance_detected": false,
  "provisional_review_gated_status": "preserved",
  "traceability_status": "adequate",
  "decision": "blocked_failed_ci",
  "confidence": 0.88,
  "manual_confirmation_required": true,
  "manual_confirmation_reasons": ["missing_github_actions_ci_evidence"],
  "required_actions": ["Retrieve or rerun GitHub Actions CI before merge review."],
  "merge_recommendation": "do_not_merge",
  "checkpoint_recommendation": "do_not_checkpoint",
  "continuity_update_recommendation": "do_not_update_current_state_yet",
  "handoff_note": "Synthetic PR is blocked because GitHub Actions evidence is missing.",
  "trace_refs": ["github:synthetic-pr-103"]
}
