{
  "skill_name": "V4 PR Review / Merge Gate Skill",
  "pr_number": 101,
  "pr_title": "Synthetic clean implementation PR",
  "branch": "synthetic-clean-ready",
  "base_branch": "main",
  "head_sha": "synthetic101",
  "mergeable": true,
  "draft": false,
  "claimed_scope": "Add governed schema/test fixture support only.",
  "changed_files": [
    { "path": "packages/vs1a/src/example-governance.test.ts", "change_type": "added", "additions": 20, "deletions": 0, "review_category": "test", "scope_status": "in_scope", "notes": "Synthetic governance test." }
  ],
  "ci_run_id": 999001,
  "ci_status": "completed",
  "ci_conclusion": "success",
  "ci_required_steps": [
    { "name": "pnpm install --frozen-lockfile=false", "required": true, "status": "passed", "conclusion": "success", "evidence": "GitHub Actions step passed" },
    { "name": "pnpm build", "required": true, "status": "passed", "conclusion": "success", "evidence": "GitHub Actions step passed" },
    { "name": "pnpm typecheck", "required": true, "status": "passed", "conclusion": "success", "evidence": "GitHub Actions step passed" },
    { "name": "pnpm test", "required": true, "status": "passed", "conclusion": "success", "evidence": "GitHub Actions step passed" },
    { "name": "pnpm validate:rules", "required": true, "status": "passed", "conclusion": "success", "evidence": "GitHub Actions step passed" },
    { "name": "pnpm sample:vs1a", "required": true, "status": "passed", "conclusion": "success", "evidence": "GitHub Actions step passed" },
    { "name": "pnpm sample:vs1a:upload", "required": true, "status": "passed", "conclusion": "success", "evidence": "GitHub Actions step passed" }
  ],
  "ci_all_required_steps_passed": true,
  "scope_alignment": "aligned",
  "guardrail_compliance": "compliant",
  "drift_risk": "low",
  "real_job_data_detected": false,
  "pdf_intelligence_detected": false,
  "unauthorized_quantity_or_cost_output_detected": false,
  "unauthorized_current_state_update_detected": false,
  "unauthorized_airtable_governance_detected": false,
  "provisional_review_gated_status": "preserved",
  "traceability_status": "adequate",
  "decision": "ready_to_merge",
  "confidence": 0.93,
  "manual_confirmation_required": false,
  "manual_confirmation_reasons": [],
  "required_actions": ["Main V4 build chat may review and decide whether to merge."],
  "merge_recommendation": "recommend_merge",
  "checkpoint_recommendation": "checkpoint_needs_merge_sha_and_airtable_record",
  "continuity_update_recommendation": "do_not_update_current_state_yet",
  "handoff_note": "Synthetic clean PR appears ready for governed merge review only.",
  "trace_refs": ["github:synthetic-pr-101", "ci:999001"]
}
