{
  "skill_name": "V4 PR Review / Merge Gate Skill",
  "pr_number": 110,
  "pr_title": "Synthetic unauthorized cost logic touch PR",
  "branch": "synthetic-cost-logic-touch",
  "base_branch": "main",
  "head_sha": "synthetic110",
  "mergeable": true,
  "draft": false,
  "claimed_scope": "Skill governance only, but touches cost logic without authorization.",
  "changed_files": [
    { "path": "packages/vs1b/src/cost-input-registry.ts", "change_type": "modified", "additions": 30, "deletions": 2, "review_category": "source_code", "scope_status": "out_of_scope", "notes": "Production cost logic touched without authorization." }
  ],
  "ci_run_id": 999010,
  "ci_status": "completed",
  "ci_conclusion": "success",
  "ci_required_steps": [
    { "name": "pnpm install --frozen-lockfile=false", "required": true, "status": "passed", "conclusion": "success", "evidence": "GitHub Actions step passed" },
    { "name": "pnpm build", "required": true, "status": "passed", "conclusion": "success", "evidence": "GitHub Actions step passed" },
    { "name": "pnpm typecheck", "required": true, "status": "passed", "conclusion": "success", "evidence": "GitHub Actions step passed" },
    { "name": "pnpm test", "required": true, "status": "passed", "conclusion": "success", "evidence": "GitHub Actions step passed" },
    { "name": "pnpm validate:rules", "required": true, "status": "passed", "conclusion": "success", "evidence": "GitHub Actions step passed" },
    { "name": "pnpm sample:vs1a", "required": true, "status": "passed", "conclusion": "success", "evidence": "GitHub Actions step passed" },
    { "name": "pnpm sample:vs1a:upload", "required": true, "status": "passed", "conclusion": "success", "evidence": "GitHub Actions step passed" }
  ],
  "ci_all_required_steps_passed": true,
  "scope_alignment": "misaligned",
  "guardrail_compliance": "violation",
  "drift_risk": "high",
  "real_job_data_detected": false,
  "pdf_intelligence_detected": false,
  "unauthorized_quantity_or_cost_output_detected": false,
  "unauthorized_current_state_update_detected": false,
  "unauthorized_airtable_governance_detected": false,
  "provisional_review_gated_status": "preserved",
  "traceability_status": "adequate",
  "decision": "blocked_guardrail_violation",
  "confidence": 0.96,
  "manual_confirmation_required": true,
  "manual_confirmation_reasons": ["unauthorized_production_rate_or_cost_logic"],
  "required_actions": ["Remove cost logic changes or create a separately authorized production-rate/cost governance slice."],
  "merge_recommendation": "do_not_merge",
  "checkpoint_recommendation": "do_not_checkpoint",
  "continuity_update_recommendation": "do_not_update_current_state_yet",
  "handoff_note": "Synthetic PR is blocked for unauthorized cost/production-rate logic touch.",
  "trace_refs": ["github:synthetic-pr-110", "guardrail:cost-logic"]
}
