{
  "skill_name": "V4 PR Review / Merge Gate Skill",
  "pr_number": 108,
  "pr_title": "Synthetic pre-merge Airtable checkpoint request",
  "branch": "synthetic-premerge-checkpoint",
  "base_branch": "main",
  "head_sha": "synthetic108",
  "mergeable": true,
  "draft": false,
  "claimed_scope": "Governance docs with premature checkpoint request.",
  "changed_files": [
    { "path": "docs/skills/example.md", "change_type": "modified", "additions": 6, "deletions": 1, "review_category": "skill_docs", "scope_status": "in_scope", "notes": "Document asks for Airtable checkpoint before merge." }
  ],
  "ci_run_id": 999008,
  "ci_status": "completed",
  "ci_conclusion": "success",
  "ci_required_steps": [
    { "name": "pnpm install --frozen-lockfile=false", "required": true, "status": "passed", "conclusion": "success", "evidence": "GitHub Actions step passed" },
    { "name": "pnpm build", "required": true, "status": "passed", "conclusion": "success", "evidence": "GitHub Actions step passed" },
    { "name": "pnpm typecheck", "required": true, "status": "passed", "conclusion": "success", "evidence": "GitHub Actions step passed" },
    { "name": "pnpm test", "required": true, "status": "passed", "conclusion": "success", "evidence": "GitHub Actions step passed" },
    { "name": "pnpm validate:rules", "required": true, "status": "passed", "conclusion": "success", "evidence": "GitHub Actions step passed" },
    { "name": "pnpm sample:vs1a", "required": true, "status": "passed", "conclusion": "success", "evidence": "GitHub Actions step passed" },
    { "name": "pnpm sample:vs1a:upload", "required": true, "status": "passed", "conclusion": "success", "evidence": "GitHub Actions step passed" }
  ],
  "ci_all_required_steps_passed": true,
  "scope_alignment": "aligned",
  "guardrail_compliance": "violation",
  "drift_risk": "medium",
  "real_job_data_detected": false,
  "pdf_intelligence_detected": false,
  "unauthorized_quantity_or_cost_output_detected": false,
  "unauthorized_current_state_update_detected": false,
  "unauthorized_airtable_governance_detected": true,
  "provisional_review_gated_status": "preserved",
  "traceability_status": "adequate",
  "decision": "blocked_guardrail_violation",
  "confidence": 0.96,
  "manual_confirmation_required": true,
  "manual_confirmation_reasons": ["airtable_checkpoint_requested_before_merge"],
  "required_actions": ["Do not create Airtable checkpoint until after merge evidence and authorization."],
  "merge_recommendation": "do_not_merge",
  "checkpoint_recommendation": "do_not_checkpoint",
  "continuity_update_recommendation": "do_not_update_current_state_yet",
  "handoff_note": "Synthetic PR is blocked because it requests Airtable checkpointing before merge evidence.",
  "trace_refs": ["github:synthetic-pr-108", "guardrail:airtable"]
}
