{
  "skill_name": "V4 PR Review / Merge Gate Skill",
  "pr_number": 107,
  "pr_title": "Synthetic premature verified claim PR",
  "branch": "synthetic-premature-verified",
  "base_branch": "main",
  "head_sha": "synthetic107",
  "mergeable": true,
  "draft": false,
  "claimed_scope": "Docs/schema/test governance support.",
  "changed_files": [
    { "path": "docs/skills/example.md", "change_type": "modified", "additions": 5, "deletions": 1, "review_category": "skill_docs", "scope_status": "in_scope", "notes": "Document claims verified before governance evidence." }
  ],
  "ci_run_id": 999007,
  "ci_status": "completed",
  "ci_conclusion": "success",
  "ci_required_steps": [
    { "name": "pnpm install --frozen-lockfile=false", "required": true, "status": "passed", "conclusion": "success", "evidence": "GitHub Actions step passed" },
    { "name": "pnpm build", "required": true, "status": "passed", "conclusion": "success", "evidence": "GitHub Actions step passed" },
    { "name": "pnpm typecheck", "required": true, "status": "passed", "conclusion": "success", "evidence": "GitHub Actions step passed" },
    { "name": "pnpm test", "required": true, "status": "passed", "conclusion": "success", "evidence": "GitHub Actions step passed" },
    { "name": "pnpm validate:rules", "required": true, "status": "passed", "conclusion": "success", "evidence": "GitHub Actions step passed" },
    { "name": "pnpm sample:vs1a", "required": true, "status": "passed", "conclusion": "success", "evidence": "GitHub Actions step passed" },
    { "name": "pnpm sample:vs1a:upload", "required": true, "status": "passed", "conclusion": "success", "evidence": "GitHub Actions step passed" }
  ],
  "ci_all_required_steps_passed": true,
  "scope_alignment": "aligned",
  "guardrail_compliance": "violation",
  "drift_risk": "medium",
  "real_job_data_detected": false,
  "pdf_intelligence_detected": false,
  "unauthorized_quantity_or_cost_output_detected": false,
  "unauthorized_current_state_update_detected": false,
  "unauthorized_airtable_governance_detected": false,
  "provisional_review_gated_status": "preserved",
  "traceability_status": "adequate",
  "decision": "blocked_guardrail_violation",
  "confidence": 0.95,
  "manual_confirmation_required": true,
  "manual_confirmation_reasons": ["premature_verified_claim"],
  "required_actions": ["Remove verified-state claim; CI and checkpoint evidence are required before verification."],
  "merge_recommendation": "do_not_merge",
  "checkpoint_recommendation": "do_not_checkpoint",
  "continuity_update_recommendation": "do_not_update_current_state_yet",
  "handoff_note": "Synthetic PR is blocked because it attempts to mark itself verified prematurely.",
  "trace_refs": ["github:synthetic-pr-107", "guardrail:verified-claim"]
}
