{
  "skill_name": "V4 PR Review / Merge Gate Skill",
  "pr_number": "unknown",
  "pr_title": "Synthetic local-only Codex result",
  "branch": "work",
  "base_branch": "main",
  "head_sha": "local-only",
  "mergeable": "unknown",
  "draft": "unknown",
  "claimed_scope": "Recover local-only Codex result into visible GitHub PR.",
  "changed_files": [
    { "path": "docs/skills/pr-review-merge-gate.md", "change_type": "added", "additions": "unknown", "deletions": "unknown", "review_category": "skill_docs", "scope_status": "ambiguous", "notes": "Local patch not visible in GitHub." }
  ],
  "ci_run_id": "unknown",
  "ci_status": "missing",
  "ci_conclusion": "missing",
  "ci_required_steps": [
    { "name": "pnpm install --frozen-lockfile=false", "required": true, "status": "missing", "conclusion": "missing", "evidence": "No GitHub Actions evidence supplied" },
    { "name": "pnpm build", "required": true, "status": "missing", "conclusion": "missing", "evidence": "No GitHub Actions evidence supplied" },
    { "name": "pnpm typecheck", "required": true, "status": "missing", "conclusion": "missing", "evidence": "No GitHub Actions evidence supplied" },
    { "name": "pnpm test", "required": true, "status": "missing", "conclusion": "missing", "evidence": "No GitHub Actions evidence supplied" },
    { "name": "pnpm validate:rules", "required": true, "status": "missing", "conclusion": "missing", "evidence": "No GitHub Actions evidence supplied" },
    { "name": "pnpm sample:vs1a", "required": true, "status": "missing", "conclusion": "missing", "evidence": "No GitHub Actions evidence supplied" },
    { "name": "pnpm sample:vs1a:upload", "required": true, "status": "missing", "conclusion": "missing", "evidence": "No GitHub Actions evidence supplied" }
  ],
  "ci_all_required_steps_passed": false,
  "scope_alignment": "unknown",
  "guardrail_compliance": "unknown",
  "drift_risk": "medium",
  "real_job_data_detected": false,
  "pdf_intelligence_detected": false,
  "unauthorized_quantity_or_cost_output_detected": false,
  "unauthorized_current_state_update_detected": false,
  "unauthorized_airtable_governance_detected": false,
  "provisional_review_gated_status": "preserved",
  "traceability_status": "missing",
  "decision": "needs_manual_review",
  "confidence": 0.74,
  "manual_confirmation_required": true,
  "manual_confirmation_reasons": ["local_only_codex_result", "missing_visible_pr", "missing_github_actions_ci_evidence"],
  "required_actions": ["Recover patch into a visible GitHub PR before merge review."],
  "merge_recommendation": "hold_for_manual_review",
  "checkpoint_recommendation": "do_not_checkpoint",
  "continuity_update_recommendation": "do_not_update_current_state_yet",
  "handoff_note": "Synthetic local-only result requires manual review and visible PR recovery.",
  "trace_refs": ["codex:local-only"]
}
