{
  "skill_name": "V4 PR Review / Merge Gate Skill",
  "pr_number": 111,
  "pr_title": "Synthetic verify report only PR review",
  "branch": "synthetic-report-only",
  "base_branch": "main",
  "head_sha": "synthetic111",
  "mergeable": true,
  "draft": false,
  "claimed_scope": "Verification/report only with no merge or checkpoint authority.",
  "changed_files": [
    { "path": "docs/skills/example.md", "change_type": "modified", "additions": 4, "deletions": 1, "review_category": "skill_docs", "scope_status": "in_scope", "notes": "Synthetic report-only fixture." }
  ],
  "ci_run_id": 999011,
  "ci_status": "completed",
  "ci_conclusion": "success",
  "ci_required_steps": [
    { "name": "pnpm install --frozen-lockfile=false", "required": true, "status": "passed", "conclusion": "success", "evidence": "GitHub Actions step passed" },
    { "name": "pnpm build", "required": true, "status": "passed", "conclusion": "success", "evidence": "GitHub Actions step passed" },
    { "name": "pnpm typecheck", "required": true, "status": "passed", "conclusion": "success", "evidence": "GitHub Actions step passed" },
    { "name": "pnpm test", "required": true, "status": "passed", "conclusion": "success", "evidence": "GitHub Actions step passed" },
    { "name": "pnpm validate:rules", "required": true, "status": "passed", "conclusion": "success", "evidence": "GitHub Actions step passed" },
    { "name": "pnpm sample:vs1a", "required": true, "status": "passed", "conclusion": "success", "evidence": "GitHub Actions step passed" },
    { "name": "pnpm sample:vs1a:upload", "required": true, "status": "passed", "conclusion": "success", "evidence": "GitHub Actions step passed" }
  ],
  "ci_all_required_steps_passed": true,
  "scope_alignment": "aligned",
  "guardrail_compliance": "compliant",
  "drift_risk": "low",
  "real_job_data_detected": false,
  "pdf_intelligence_detected": false,
  "unauthorized_quantity_or_cost_output_detected": false,
  "unauthorized_current_state_update_detected": false,
  "unauthorized_airtable_governance_detected": false,
  "provisional_review_gated_status": "preserved",
  "traceability_status": "adequate",
  "decision": "not_checkpoint_eligible",
  "confidence": 0.9,
  "manual_confirmation_required": false,
  "manual_confirmation_reasons": [],
  "required_actions": ["Report only; do not merge or checkpoint from this output."],
  "merge_recommendation": "report_only_no_merge_recommendation",
  "checkpoint_recommendation": "not_applicable",
  "continuity_update_recommendation": "not_applicable",
  "handoff_note": "Synthetic report-only review creates no merge or checkpoint authority.",
  "trace_refs": ["github:synthetic-pr-111", "mode:verify-report-only"]
}
