{
  "skill_name": "V4 PR Review / Merge Gate Skill",
  "pr_number": 105,
  "pr_title": "Synthetic scope drift PR",
  "branch": "synthetic-scope-drift",
  "base_branch": "main",
  "head_sha": "synthetic105",
  "mergeable": true,
  "draft": false,
  "claimed_scope": "Skill governance docs/schema/test only.",
  "changed_files": [
    { "path": "packages/vs1b/src/cost-scenario-output.ts", "change_type": "modified", "additions": 20, "deletions": 4, "review_category": "source_code", "scope_status": "out_of_scope", "notes": "Cost source code changed in a skill-governance PR." }
  ],
  "ci_run_id": 999005,
  "ci_status": "completed",
  "ci_conclusion": "success",
  "ci_required_steps": [
    { "name": "pnpm install --frozen-lockfile=false", "required": true, "status": "passed", "conclusion": "success", "evidence": "GitHub Actions step passed" },
    { "name": "pnpm build", "required": true, "status": "passed", "conclusion": "success", "evidence": "GitHub Actions step passed" },
    { "name": "pnpm typecheck", "required": true, "status": "passed", "conclusion": "success", "evidence": "GitHub Actions step passed" },
    { "name": "pnpm test", "required": true, "status": "passed", "conclusion": "success", "evidence": "GitHub Actions step passed" },
    { "name": "pnpm validate:rules", "required": true, "status": "passed", "conclusion": "success", "evidence": "GitHub Actions step passed" },
    { "name": "pnpm sample:vs1a", "required": true, "status": "passed", "conclusion": "success", "evidence": "GitHub Actions step passed" },
    { "name": "pnpm sample:vs1a:upload", "required": true, "status": "passed", "conclusion": "success", "evidence": "GitHub Actions step passed" }
  ],
  "ci_all_required_steps_passed": true,
  "scope_alignment": "misaligned",
  "guardrail_compliance": "needs_review",
  "drift_risk": "high",
  "real_job_data_detected": false,
  "pdf_intelligence_detected": false,
  "unauthorized_quantity_or_cost_output_detected": false,
  "unauthorized_current_state_update_detected": false,
  "unauthorized_airtable_governance_detected": false,
  "provisional_review_gated_status": "preserved",
  "traceability_status": "adequate",
  "decision": "blocked_scope_drift",
  "confidence": 0.94,
  "manual_confirmation_required": true,
  "manual_confirmation_reasons": ["changed_files_outside_claimed_scope"],
  "required_actions": ["Remove out-of-scope code changes or create a separately authorized slice."],
  "merge_recommendation": "do_not_merge",
  "checkpoint_recommendation": "do_not_checkpoint",
  "continuity_update_recommendation": "do_not_update_current_state_yet",
  "handoff_note": "Synthetic PR is blocked for changed-file scope drift.",
  "trace_refs": ["github:synthetic-pr-105", "scope:drift"]
}
