{
  "skill_name": "V4 PR Review / Merge Gate Skill",
  "pr_number": 104,
  "pr_title": "Synthetic authorized continuity update",
  "branch": "synthetic-continuity-authorized",
  "base_branch": "main",
  "head_sha": "synthetic104",
  "mergeable": true,
  "draft": false,
  "claimed_scope": "Authorized docs-only continuity update after checkpoint evidence.",
  "changed_files": [
    { "path": "docs/continuity/current-state.md", "change_type": "modified", "additions": 12, "deletions": 3, "review_category": "continuity_docs", "scope_status": "in_scope", "notes": "Explicitly authorized synthetic continuity fixture." }
  ],
  "ci_run_id": 999004,
  "ci_status": "completed",
  "ci_conclusion": "success",
  "ci_required_steps": [
    { "name": "pnpm install --frozen-lockfile=false", "required": true, "status": "passed", "conclusion": "success", "evidence": "GitHub Actions step passed" },
    { "name": "pnpm build", "required": true, "status": "passed", "conclusion": "success", "evidence": "GitHub Actions step passed" },
    { "name": "pnpm typecheck", "required": true, "status": "passed", "conclusion": "success", "evidence": "GitHub Actions step passed" },
    { "name": "pnpm test", "required": true, "status": "passed", "conclusion": "success", "evidence": "GitHub Actions step passed" },
    { "name": "pnpm validate:rules", "required": true, "status": "passed", "conclusion": "success", "evidence": "GitHub Actions step passed" },
    { "name": "pnpm sample:vs1a", "required": true, "status": "passed", "conclusion": "success", "evidence": "GitHub Actions step passed" },
    { "name": "pnpm sample:vs1a:upload", "required": true, "status": "passed", "conclusion": "success", "evidence": "GitHub Actions step passed" }
  ],
  "ci_all_required_steps_passed": true,
  "scope_alignment": "aligned",
  "guardrail_compliance": "compliant",
  "drift_risk": "low",
  "real_job_data_detected": false,
  "pdf_intelligence_detected": false,
  "unauthorized_quantity_or_cost_output_detected": false,
  "unauthorized_current_state_update_detected": false,
  "unauthorized_airtable_governance_detected": false,
  "provisional_review_gated_status": "preserved",
  "traceability_status": "adequate",
  "decision": "docs_only_ready",
  "confidence": 0.91,
  "manual_confirmation_required": false,
  "manual_confirmation_reasons": [],
  "required_actions": ["Main V4 build chat may review authorized docs-only continuity scope."],
  "merge_recommendation": "recommend_merge",
  "checkpoint_recommendation": "not_applicable",
  "continuity_update_recommendation": "continuity_update_ready",
  "handoff_note": "Synthetic docs-only continuity PR is authorized and CI-passing.",
  "trace_refs": ["github:synthetic-pr-104", "authorization:continuity"]
}
