{
  "skill_name": "V4 PR Review / Merge Gate Skill",
  "pr_number": 112,
  "pr_title": "Synthetic current-state after merge checkpoint context",
  "branch": "synthetic-after-merge-checkpoint",
  "base_branch": "main",
  "head_sha": "synthetic112",
  "mergeable": true,
  "draft": false,
  "claimed_scope": "Post-merge checkpoint/continuity context after evidence is available.",
  "changed_files": [
    { "path": "docs/continuity/current-state.md", "change_type": "modified", "additions": 18, "deletions": 6, "review_category": "continuity_docs", "scope_status": "in_scope", "notes": "Post-merge checkpoint continuity context." }
  ],
  "ci_run_id": 999012,
  "ci_status": "completed",
  "ci_conclusion": "success",
  "ci_required_steps": [
    { "name": "pnpm install --frozen-lockfile=false", "required": true, "status": "passed", "conclusion": "success", "evidence": "GitHub Actions step passed" },
    { "name": "pnpm build", "required": true, "status": "passed", "conclusion": "success", "evidence": "GitHub Actions step passed" },
    { "name": "pnpm typecheck", "required": true, "status": "passed", "conclusion": "success", "evidence": "GitHub Actions step passed" },
    { "name": "pnpm test", "required": true, "status": "passed", "conclusion": "success", "evidence": "GitHub Actions step passed" },
    { "name": "pnpm validate:rules", "required": true, "status": "passed", "conclusion": "success", "evidence": "GitHub Actions step passed" },
    { "name": "pnpm sample:vs1a", "required": true, "status": "passed", "conclusion": "success", "evidence": "GitHub Actions step passed" },
    { "name": "pnpm sample:vs1a:upload", "required": true, "status": "passed", "conclusion": "success", "evidence": "GitHub Actions step passed" }
  ],
  "ci_all_required_steps_passed": true,
  "scope_alignment": "aligned",
  "guardrail_compliance": "compliant",
  "drift_risk": "low",
  "real_job_data_detected": false,
  "pdf_intelligence_detected": false,
  "unauthorized_quantity_or_cost_output_detected": false,
  "unauthorized_current_state_update_detected": false,
  "unauthorized_airtable_governance_detected": false,
  "provisional_review_gated_status": "preserved",
  "traceability_status": "adequate",
  "decision": "checkpoint_ready_after_merge",
  "confidence": 0.92,
  "manual_confirmation_required": false,
  "manual_confirmation_reasons": [],
  "required_actions": ["Use only after merge SHA and Airtable checkpoint evidence are present."],
  "merge_recommendation": "report_only_no_merge_recommendation",
  "checkpoint_recommendation": "checkpoint_after_merge",
  "continuity_update_recommendation": "create_continuity_update_pr_after_checkpoint",
  "handoff_note": "Synthetic post-merge context is checkpoint-ready only after merge and Airtable evidence are present.",
  "trace_refs": ["github:synthetic-pr-112", "merge:synthetic-sha", "airtable:synthetic-checkpoint"]
}
