{
  "skill_name": "V4 PR Review / Merge Gate Skill",
  "pr_number": 109,
  "pr_title": "Synthetic real data PDF quantity cost risk PR",
  "branch": "synthetic-real-data-risk",
  "base_branch": "main",
  "head_sha": "synthetic109",
  "mergeable": true,
  "draft": false,
  "claimed_scope": "Skill governance only, but includes unauthorized real-data/PDF/quantity-cost risk.",
  "changed_files": [
    { "path": "tests/fixtures/project-data/promenade.json", "change_type": "added", "additions": 50, "deletions": 0, "review_category": "project_data", "scope_status": "out_of_scope", "notes": "Synthetic risk case names real job data boundary." }
  ],
  "ci_run_id": 999009,
  "ci_status": "completed",
  "ci_conclusion": "success",
  "ci_required_steps": [
    { "name": "pnpm install --frozen-lockfile=false", "required": true, "status": "passed", "conclusion": "success", "evidence": "GitHub Actions step passed" },
    { "name": "pnpm build", "required": true, "status": "passed", "conclusion": "success", "evidence": "GitHub Actions step passed" },
    { "name": "pnpm typecheck", "required": true, "status": "passed", "conclusion": "success", "evidence": "GitHub Actions step passed" },
    { "name": "pnpm test", "required": true, "status": "passed", "conclusion": "success", "evidence": "GitHub Actions step passed" },
    { "name": "pnpm validate:rules", "required": true, "status": "passed", "conclusion": "success", "evidence": "GitHub Actions step passed" },
    { "name": "pnpm sample:vs1a", "required": true, "status": "passed", "conclusion": "success", "evidence": "GitHub Actions step passed" },
    { "name": "pnpm sample:vs1a:upload", "required": true, "status": "passed", "conclusion": "success", "evidence": "GitHub Actions step passed" }
  ],
  "ci_all_required_steps_passed": true,
  "scope_alignment": "misaligned",
  "guardrail_compliance": "violation",
  "drift_risk": "high",
  "real_job_data_detected": true,
  "pdf_intelligence_detected": true,
  "unauthorized_quantity_or_cost_output_detected": true,
  "unauthorized_current_state_update_detected": false,
  "unauthorized_airtable_governance_detected": false,
  "provisional_review_gated_status": "preserved",
  "traceability_status": "adequate",
  "decision": "blocked_guardrail_violation",
  "confidence": 0.97,
  "manual_confirmation_required": true,
  "manual_confirmation_reasons": ["real_job_data", "pdf_intelligence", "unauthorized_quantity_or_cost_output"],
  "required_actions": ["Remove unauthorized real job data/PDF intelligence/quantity-cost outputs or obtain explicit governance scope."],
  "merge_recommendation": "do_not_merge",
  "checkpoint_recommendation": "do_not_checkpoint",
  "continuity_update_recommendation": "do_not_update_current_state_yet",
  "handoff_note": "Synthetic PR is blocked for real-data/PDF/quantity-cost guardrail risk.",
  "trace_refs": ["github:synthetic-pr-109", "guardrail:real-data"]
}
